Let bygones be bygones.	Let bygones be bygones	753	Esquecer o passado.	Esquecer o passado.	Esquecer o passado	754	?? ?? ??? ?? ?? ????	?? ?? ??? ?? ?? ???	755	jo ho gaya so ho gaya.	jo ho gaya so ho gaya	756												
Great minds think alike.	Great minds think alike	757	Mentes brilhantes pensam igual.	Mentes brilhantes pensam igual.	Mentes brilhantes pensam igual	758	???? ?? ???? ??? ????? ????	???? ?? ???? ??? ????? ???	759	bade man vaale aisa sochate hain.	bade man vaale aisa sochate hain	760												
I walked across the park.	I walked across the park	761	Eu atravessei o parque.	Eu atravessei o parque.	Eu atravessei o parque	762	??? ????? ?? ??? ??? ????	??? ????? ?? ??? ??? ???	763	main paark bhar mein chala gaya.	main paark bhar mein chala gaya	764												
I'll just play it by ear.	I'll just play it by ear	765	Eu apenas tocarei de ouvido.	Eu apenas tocarei de ouvido.	Eu apenas tocarei de ouvido	766	??? ??? ??? ??? ?? ????????	??? ??? ??? ??? ?? ???????	767	main abhee ise kaan se bajaoonga.	main abhee ise kaan se bajaoonga	768												
I'm not sure I can do it.	I'm not sure I can do it	769	Não tenho certeza se posso fazer isso.	Não tenho certeza se posso fazer isso.	Não tenho certeza se posso fazer isso	770	???? ???? ???? ?? ?? ??? ?? ?? ???? ????	???? ???? ???? ?? ?? ??? ?? ?? ???? ???	771	mujhe yakeen nahin hai ki main yah kar sakata hoon.	mujhe yakeen nahin hai ki main yah kar sakata hoon	772												
I'm not used to drinking.	I'm not used to drinking	773	Eu não estou acostumado a beber.	Eu não estou acostumado a beber.	Eu não estou acostumado a beber	774	???? ???? ?? ??? ???? ???	???? ???? ?? ??? ???? ??	775	mujhe peene kee aadat nahin hai.	mujhe peene kee aadat nahin hai	776												
Let's not waste our time.	Let's not waste our time	777	Não vamos perder nosso tempo.	Não vamos perder nosso tempo.	Não vamos perder nosso tempo	778	???? ???? ??? ????? ???? ???? ???????	???? ???? ??? ????? ???? ???? ??????	779	hamen apana samay barabaad nahin karana chaahiye.	hamen apana samay barabaad nahin karana chaahiye	780												
Stop making noise.	Stop making noise	781	Pare de fazer barulho.	Pare de fazer barulho.	Pare de fazer barulho	782	??? ???? ??? ????	??? ???? ??? ???	783	shor karana band karo.	shor karana band karo	784												
That makes no difference.	That makes no difference	785	Isso não faz diferença.	Isso não faz diferença.	Isso não faz diferença	786	???? ??? ???? ???? ??????	???? ??? ???? ???? ?????	787	isase koee phark nahin padata.	isase koee phark nahin padata	788												
The price is reasonable.	The price is reasonable	789	O preço é razoável.	O preço é razoável.	O preço é razoável	790	???? ????? ???	???? ????? ??	791	keemat vaajib hai.	keemat vaajib hai	792												
I have a surprise for you.	I have a surprise for you	793	Eu tenho uma surpresa para você.	Eu tenho uma surpresa para você.	Eu tenho uma surpresa para você	794	???? ??? ???????? ??? ?? ???????? ???	???? ??? ???????? ??? ?? ???????? ??	795	mere paas tumhaare lie ek sarapraij hai.	mere paas tumhaare lie ek sarapraij hai	796												
